book,num,title,title2,originalTitle,composer,composer2,author,author2,theme
JEM,749,El Kanna,Tu es jaloux,,"Panci McGowen, Linda; Schneider, Rolf",Linda Panci McGowen ; Rolf Schneider,"Panci-McGowen, Tom et Linda",Tom et Linda Panci-McGowen,Dieu
JEM,750,El Roï,Dans les heures sombres,,"Panci-McGowen, Linda",Linda Panci-McGowen,"Panci-McGowen, Tom et Linda",Tom et Linda Panci-McGowen,Intimité
JEM,751,Ensemble,Notre Dieu nous a créés,,"Siounath, Charly",Charly Siounath,"Siounath, Charly",Charly Siounath,Unité
JEM,752,Entrons dans ce lieu,À lui soient l'honneur,Come into this House,"Oliver, Gary",Gary Oliver,"Oliver, Gary",Gary Oliver,Joie et célébration
JEM,753,Esprit de Dieu,Viens comme un souffle,Tule Pyhä Henki!,"Pyhä, Tule ; Pekka, Simojoki",Tule Pyhä ; Simojoki Pekka,"Pyhä, Tule ; Pekka, Simojoki",Tule Pyhä ; Simojoki Pekka,Saint-Esprit
JEM,754,Faites résonner,Faites résonner un chant de victoire,,"Schneider, Michel",Michel Schneider,"Schneider, Michel",Michel Schneider,Exhortation
JEM,755,Feu du réveil,Brûle en nous,,"Schneider, Rolf",Rolf Schneider,"Schneider, Rolf",Rolf Schneider,Prière
JEM,756,Homme de douleur,Oh ! je méritais la mort,,"Debenest, Fabien",Fabien Debenest,"Debenest, Fabien",Fabien Debenest,Evangélisation
JEM,757,Hommes de foi,Criez au nord et au sud,Men of Faith,"Smith, Martin James",Martin James Smith,"Smith, Martin James",Martin James Smith,Exhortation
JEM,758,Il est Seigneur,L'heure est arrivée,,"Christensen, Chris ; Ostrini, Thierry",Chris Christensen ; Thierry Ostrini,"Christensen, Chris ; Ostrini, Thierry",Chris Christensen ; Thierry Ostrini,Proclamation
JEM,759,Il est vivant,Chante au Seigneur,,"Motte, Thérèse",Thérèse Motte,"Motte, Thérèse",Thérèse Motte,Louange
JEM,760,Il est vivant,"Peuple de Dieu, réjouis-toi",,"Debenest, Pascale et Vanessa",Pascale et Vanessa Debenest,"Debenest, Pascale et Vanessa",Pascale et Vanessa Debenest,Louange
JEM,761,Il m'aime,Il m'a tant donné,,"Schnegg, Judith",Judith Schnegg,"Schnegg, Judith",Judith Schnegg,Engagement
JEM,762,J'ai confiance,"J'ai confiance quand, dans ta présence",Trust in the Lord,"Bowater, Chris",Chris Bowater,"Bowater, Chris",Chris Bowater,Foi et confiance
JEM,763,Je crois,Roi de paix venu du ciel,,"Schneider, Rolf",Rolf Schneider,"Schneider, Rolf",Rolf Schneider,Confession
JEM,764,Je déclare,À Dieu soient le règne,,"Ostrini, Thierry",Thierry Ostrini,"Ostrini, Thierry",Thierry Ostrini,Confession
JEM,765,Je dépose devant toi,J'ouvre mon cœur à ton Esprit,,"Rochat, Etienne",Etienne Rochat,"Rochat, Etienne",Etienne Rochat,Confession
JEM,766,Je fléchis le genou,Et j'abandonne entre tes mains,,"Ternisien, Nicolas",Nicolas Ternisien,"Ternisien, Nicolas",Nicolas Ternisien,Confession
JEM,767,Je le reconnais,Apprends-moi à te servir,,"Freymond, Sylvain",Sylvain Freymond,"Freymond, Sylvain",Sylvain Freymond,Confession
JEM,768,Je sais en vérité,,,"Berning, Pat",Pat Berning,"Berning, Pat",Pat Berning,Louange
JEM,769,Jésus-Christ,Je repense à ton sacrifice,Jesus Christ,"Redman, Matt",Matt Redman,"Redman, Matt",Matt Redman,Jésus-Christ
JEM,770,Jésus est ressuscité,"Pourquoi, parmi les morts",,"Berning, Pat",Pat Berning,"Berning, Pat",Pat Berning,Jésus-Christ
JEM,771,"Jésus, j'élève ma voix vers toi",,,"Pialat, Daniel",Daniel Pialat,"Pialat, Daniel",Daniel Pialat,Joie et célébration
JEM,772,Jésus sois le centre,,Be the Center,"Frye, Michael",Michael Frye,"Frye, Michael",Michael Frye,Prière
JEM,773,Je veux demeurer dans ta grâce,,,"Lafitte, Corinne",Corinne Lafitte,"Lafitte, Corinne",Corinne Lafitte,Confession
JEM,774,Je veux te rester fidèle,,,"Freymond, Sylvain",Sylvain Freymond,"Freymond, Sylvain",Sylvain Freymond,Engagement
JEM,775,Je viens t'adorer,Vivre près de toi,,"Schneider, Rolf",Rolf Schneider,"Schneider, Rolf",Rolf Schneider,Engagement
JEM,776,La présence de mon Dieu,Je connais un endroit,,"Bourbouze, Elisabeth",Elisabeth Bourbouze,"Bourbouze, Elisabeth",Elisabeth Bourbouze,Intimité
JEM,777,La lumière de ta présence,Réchauffe mon âme,,"Panci-McGowen, Linda",Linda Panci-McGowen,"Panci-McGowen, Linda",Linda Panci-McGowen,Prière
JEM,778,Le centre de ma vie,"Jésus, sois le centre de ma vie",,Hemanasion,Hemanasion,Hemanasion,Hemanasion,Consécration
JEM,779,Le chant du Père,J'ai chanté tant de chansons,The Father's Song,"Redman, Matt",Matt Redman,"Redman, Matt",Matt Redman,Dieu
JEM,780,Le cri d'El shaddaï,Entendez-vous?,The Shout of El Shaddaï,"Wilbur, Paul ; Kerr, Ed",Paul Wilbur ; Ed Kerr,"Wilbur, Paul ; Kerr, Ed",Paul Wilbur ; Ed Kerr,Combat spirituel
JEM,781,Le lion de Juda,Nous élevons la voix,The Lion of Judah,"Bell, Dave",Dave Bell,"Bell, Dave",Dave Bell,Proclamation
JEM,782,Le plus grand amour,Il n'y a pas de plus grand amour,,"Ben, Bruno ; Harmonisation: Fady, Barbara",Bruno Ben ; Harmonisation: Barbara Fady,Jean-Louis Fradon,Jean-Louis Fradon,Unité
JEM,783,Le plus haut,"Lui, qui est monté",,"Alonso, Gabriel",Gabriel Alonso,"Alonso, Gabriel",Gabriel Alonso,Proclamation
JEM,784,Lève-toi,Que tes ennemis soient dispersés !,,"Andres, Joël",Joël Andres,"Andres, Joël",Joël Andres,Intercession
JEM,785,"Louange, honneur, gloire","De tout éternité, tu es le Fils aimé",,"Freymond, Sylvain",Sylvain Freymond,"Freymond, Sylvain",Sylvain Freymond,Louange
JEM,786,Louez Adonaï,Qui est semblable ?,Praise Adonaï,"Baloche, Paul",Paul Baloche,"Baloche, Paul",Paul Baloche,Louange
JEM,787,"Louez, louez",Louez l'Éternel !,,"Lafitte, Corinne",Corinne Lafitte,"Lafitte, Corinne",Corinne Lafitte,Louange
JEM,788,Lumière du monde,Et me voici pour louer,Light of the World,"Hughes, Tim",Tim Hughes,"Hughes, Tim",Tim Hughes,Confession
JEM,789,M'approcher de Dieu,"Pour moi, m'approcher de Dieu",,"Panci-McGowen, Linda",Linda Panci-McGowen,"Panci-McGowen, Linda",Linda Panci-McGowen,Intimité
JEM,790,Maranatha,Il revient victorieux,,"Schnegg, Judith",Judith Schnegg,"Schnegg, Judith",Judith Schnegg,Espérance
JEM,791,Merci Seigneur,Pour ton amour,,"Berning, Pat",Pat Berning,"Berning, Pat",Pat Berning,Reconnaissance
JEM,792,Mes mots sont peu de chose,"Tu es mon espérance, ma joie",,"Freymond, Sylvain",Sylvain Freymond,"Freymond, Sylvain",Sylvain Freymond,Louange
JEM,793,"Me voici, Seigneur",Pour faire ta volonté,,"Freymond, Sylvain",Sylvain Freymond,"Freymond, Sylvain",Sylvain Freymond,Consécration
JEM,794,Mon ancre et ma voile,"Dieu, tu es ma force",,"Durham, David",David Durham,"Durham, David ; Schneider, Rolf",David Durham ; Rolf Schneider,Prière
JEM,795,Mon coeur t'appartient,"Et je te louerai, Seigneur","Lord, you have my Heart","Smith, Martin James",Martin James Smith,"Smith, Martin James",Martin James Smith,Consécration
JEM,796,"Mon Dieu, toi le Roi",,,"Berning, Pat",Pat Berning,"Berning, Pat",Pat Berning,Louange
JEM,797,Naître,Etre ou ne pas être,,"Ostrini, Thierry",Thierry Ostrini,"Ostrini, Thierry",Thierry Ostrini,Consécration
JEM,798,Notre Dieu a triomphé,"Jésus est Seigneur, il est le vainqueur",,"Bourbouze, Elisabeth",Elisabeth Bourbouze,"Bourbouze, Elisabeth",Elisabeth Bourbouze,Exhortation
JEM,799,Nous annonçons le Roi,De nos montagnes,,"Decourroux, Philippe",Philippe Decourroux,"Decourroux, Philippe",Philippe Decourroux,Combat spirituel
JEM,800,Nous élevons le nom qui sauve,,,"Motte, Thérèse",Thérèse Motte,"Motte, Thérèse",Thérèse Motte,Exhortation
JEM,801,Nous nous attendons à te voir,,,"Lafitte, Corinne",Corinne Lafitte,"Lafitte, Corinne",Corinne Lafitte,Prière
JEM,802,Nous sommes dans la joie,Quand l'Eternel ramena,,"Berning, Pat",Pat Berning,"Berning, Pat",Pat Berning,Joie et célébration
JEM,803,Nous sommes un peuple,Un peuple qui chante,,"Lachat, Pierre",Pierre Lachat,"Lachat, Pierre",Pierre Lachat,L'Eglise
JEM,804,Nous sommes venus,Et nous avons cru,Wir sind gekommen,"Keller, Lilo",Lilo Keller,"Keller, Lilo",Lilo Keller,Louange
JEM,805,Nous venons dans ta présence,Sans un défaut et sans tache,Into Your Presence We Come,"Lane, Tom",Tom Lane,"Lane, Tom",Tom Lane,Adoration
JEM,806,O Dieu mon roc,"Entends mon cri, ô Dieu",,"Panci McGowen, Linda; Schneider, Rolf",Linda Panci McGowen ; Rolf Schneider,"Panci McGowen, Linda; Schneider, Rolf",Linda Panci McGowen ; Rolf Schneider,Prière
JEM,807,"O Dieu, tu es mon Dieu",Je te chercherai dès l'aurore,Step by Step,Beaker,Beaker,Beaker,Beaker,Consécration
JEM,808,Oui ce pain,"Je suis pauvre, je suis nu",,"Gallay, Jean-Jacques",Jean-Jacques Gallay,"Gallay, Jean-Jacques",Jean-Jacques Gallay,Sainte-cène
JEM,809,Ouvre le ciel,"Seigneur, tes promesses",,"Schneider, Rolf",Rolf Schneider,"Schneider, Rolf",Rolf Schneider,Intercession
JEM,810,Par ton Esprit,"Accorde-nous, Seigneur",,"Schneider, Rolf",Rolf Schneider,"Schneider, Rolf",Rolf Schneider,Intercession
JEM,811,Père,"Père, être près de ton cœur",,"Ternisien, Nicolas",Nicolas Ternisien,"Ternisien, Nicolas",Nicolas Ternisien,Intimité
JEM,812,"Peuples, élevez la bannière",,Lift High the Banners of Love,"Gillard, Richard",Richard Gillard,"Gillard, Richard",Richard Gillard,Combat spirituel
JEM,813,Préparez au désert,Que toute vallée soit exhaussée,,"Bourbouze, Elisabeth",Elisabeth Bourbouze,"Bourbouze, Elisabeth",Elisabeth Bourbouze,Exhortation
JEM,814,Parfum de louange,Même si mon chant,,"Schneider, Rolf",Rolf Schneider,"Schneider, Rolf",Rolf Schneider,Consécration
JEM,815,Prosternés,"Prosternés, nous confessons",We bow down,"Grafstrom, Viola",Viola Grafstrom,"Grafstrom, Viola",Viola Grafstrom,Confession
JEM,816,Quand les montagnes,Quand les montagnes chancelleraient,,"Bourbouze, Elisabeth",Elisabeth Bourbouze,"Bourbouze, Elisabeth",Elisabeth Bourbouze,Dieu
JEM,817,Que ta gloire descende,Créateur et Père,Let your Glory Fall,"Ruis, David",David Ruis,"Ruis, David",David Ruis,Intercession
JEM,818,Que ton nom est merveilleux,"Dieu, que ton nom est merveilleux",,"Alonso, Gabriel",Gabriel Alonso,"Alonso, Gabriel",Gabriel Alonso,Adoration
JEM,819,Que ton règne vienne,Notre Père,,"Motte, Thérèse",Thérèse Motte,"Motte, Thérèse",Thérèse Motte,Prière
JEM,820,Qui est comme Dieu ?,Vraiment personne !,Stand up and give him the Praise,"Deshazo, Lynn",Lynn Deshazo,"Deshazo, Lynn",Lynn Deshazo,Louange
JEM,821,Règne en moi,Dans le monde entier,"Lord, reign in me","Brown, Brenton",Brenton Brown,"Brown, Brenton",Brenton Brown,Consécration
JEM,822,Rien n'est impossible à mon Dieu,,,"Freymond, Sylvain",Sylvain Freymond,"Freymond, Sylvain",Sylvain Freymond,Louange
JEM,823,"Shalom, Jérusalem","Prie pour la paix, Jérusalem",Shalom Jerusalem,"Wilbur, Paul",Paul Wilbur,"Wilbur, Paul",Paul Wilbur,Israël
JEM,824,Seigneur de la vie,La mort a été engloutie,,"Bourbouze, Elisabeth",Elisabeth Bourbouze,"Bourbouze, Elisabeth",Elisabeth Bourbouze,Louange
JEM,825,Sonde-moi,"Sonde-moi, ô Dieu et connais mon cœur !",,"Bourbouze, Elisabeth",Elisabeth Bourbouze,"Bourbouze, Elisabeth",Elisabeth Bourbouze,Prière
JEM,826,Sonne la trompette,Frappe des mains,Sound the Trumpet,"Bilbrough, David",David Bilbrough,"Bilbrough, David",David Bilbrough,Exhortation
JEM,827,Sur la terre entière,Ton fleuve s'écoule,All over the World,"Butler, Terry",Terry Butler,"Butler, Terry",Terry Butler,Saint-Esprit
JEM,828,Ta parole,Quand parfois je crains,Thy Word,"Grant, Amy",Amy Grant,"Grant, Amy ; Smith, Michaël W.",Amy Grant ; Michaël W. Smith,Foi et confiance
JEM,829,Te connaître,Ce qui m'était cher,Knowing You,"Kendrick, Graham",Graham Kendrick,"Kendrick, Graham",Graham Kendrick,Consécration
JEM,830,Tiens-moi dans tes bras,J'ai tout en toi,Draw me close to you,"Carpenter, Kelly",Kelly Carpenter,"Carpenter, Kelly",Kelly Carpenter,Intimité
JEM,831,Tous les rois de la terre,,,"Berning, Pat",Pat Berning,"Berning, Pat",Pat Berning,Louange
JEM,832,Transformé,Emerveillé,,"Wurtz, Nicolas",Nicolas Wurtz,"Wurtz, Nicolas",Nicolas Wurtz,Repentance
JEM,833,Tu adoreras,Tu adoreras le Seigneur ton Dieu,,"Lafitte, Corinne",Corinne Lafitte,"Lafitte, Corinne",Corinne Lafitte,Exhortation
JEM,834,Tu es digne,Tu es digne de recevoir,,"Andres, Joël",Joël Andres,"Andres, Joël",Joël Andres,Adoration
JEM,835,Tu seras toujours,Ta présence est un festin savoureux,,"Schneider, Rolf",Rolf Schneider,"Schneider, Rolf",Rolf Schneider,Intimité
JEM,836,Venez chanter de joie,Venez chanter de joie pour le Seigneur,Sing Hallelujah,"Wilbur, Paul",Paul Wilbur,"Wilbur, Paul",Paul Wilbur,Exhortation
JEM,837,"Viens, Esprit du Dieu vivant",,,"Lafitte, Corinne",Corinne Lafitte,"Lafitte, Corinne",Corinne Lafitte,Saint-Esprit
JEM,838,Voici l'Agneau,Chérubins et séraphins,Behold the Lamb,"Perrin, Cathy",Cathy Perrin,"Perrin, Cathy",Cathy Perrin,Proclamation
JEM,839,Adorons le Père,Tu es le seul Roi si grand,,"Freymond, Sylvain",Sylvain Freymond,"Freymond, Sylvain",Sylvain Freymond,Consécration
JEM,840,Adorons,Adorons l'Agneau,,"Lafitte, Corinne",Corinne Lafitte,"Lafitte, Corinne",Corinne Lafitte,Adoration
JEM,841,À genoux devant toi,,,"Reymond, François",François Reymond,"Reymond, François",François Reymond,Consécration
JEM,842,Alléluia,Nous venons t'offrir nos louanges,,"de Katow, Pierre-Nicolas",Pierre-Nicolas de Katow,"de Katow, Pierre-Nicolas",Pierre-Nicolas de Katow,Adoration
JEM,843,"Alléluia, ton amour est là",Ton amour étonnant,Your Love Is Amazing,"Doerksen, Brian ; Brown, Brenton",Brian Doerksen ; Brenton Brown,"Doerksen, Brian ; Brown, Brenton",Brian Doerksen ; Brenton Brown,Foi et confiance
JEM,844,Au siècle des siècles,Car il est Dieu au-dessus de la terre,,"Dumont, Luc",Luc Dumont,"Dumont, Luc",Luc Dumont,Adoration
JEM,845,Avec patience,Tu es le rocher qui nous a suivis,,"Lafitte, Corinne",Corinne Lafitte,"Lafitte, Corinne",Corinne Lafitte,Confession
JEM,846,Bénissez l'Eternel,Les voies de l'Éternel sont justes,,"Lafitte, Corinne",Corinne Lafitte,"Lafitte, Corinne",Corinne Lafitte,Israël
JEM,847,C'est dans le calme,,,"Durham, David",David Durham,"Durham, David",David Durham,Foi et confiance
JEM,848,C'est la journée que Dieu a faite,,,"Schneider, Michel",Michel Schneider,"Schneider, Michel",Michel Schneider,Joie et célébration
JEM,849,Craindre ton nom,,,"Lafitte, Corinne",Corinne Lafitte,"Lafitte, Corinne",Corinne Lafitte,Bénédiction
JEM,850,Christ est Roi,"Dans son amour, Dieu, le Père",,"Picotin, Richard",Richard Picotin,"Picotin, Richard",Richard Picotin,Confession
JEM,851,Comme une colombe,"Ton amour, ô Jésus",,"Charton, Francine",Francine Charton,"Charton, Francine",Francine Charton,Intimité
JEM,852,Comment te dire merci,Quand je vois la beauté,What can I do,"Kendrick, Graham ; Baloche, Paul",Graham Kendrick ; Paul Baloche,"Kendrick, Graham ; Baloche, Paul",Graham Kendrick ; Paul Baloche,Jésus-Christ
JEM,853,Dieu merveilleux,Qui est semblable au Dieu,,"de Katow, Pierre-Nicolas",Pierre-Nicolas de Katow,"de Katow, Pierre-Nicolas",Pierre-Nicolas de Katow,Dieu
JEM,854,"Dieu tout-Puissant, mon Rédempteur",,"Almighty God, My Redeemer","Zchech, Darlene",Darlene Zchech,"Zchech, Darlene",Darlene Zchech,Dieu
JEM,855,Il est grand,"Saint, trois fois saint",High and Exalted,"Rasmussen, Kyle",Kyle Rasmussen,"Rasmussen, Kyle",Kyle Rasmussen,Dieu
JEM,856,Élevez-vous,Élevez-vous portails éternels,,"Boskey, Avner",Avner Boskey,"Boskey, Avner",Avner Boskey,Intercession
JEM,857,Encore Dieu,"Tu as tout créé, Dieu",,"Picotin, Richard",Richard Picotin,"Picotin, Richard",Richard Picotin,Dieu
JEM,858,Inépuisable grâce,C'est par tes souffrances que je suis guéri,,"Schneider, Rolf",Rolf Schneider,"Schneider, Rolf",Rolf Schneider,Sainte-cène
JEM,859,J'ai faim,A genoux,Hungry,"Scott, Kathryn",Kathryn Scott,"Scott, Kathryn",Kathryn Scott,Consécration
JEM,860,J'aime l'Eternel,Il a essuyé les larmes de mes yeux,,"Dumont, Luc",Luc Dumont,"Dumont, Luc",Luc Dumont,Adoration
JEM,861,Je compte sur toi,Tous les jours tu es fidèle,,"de Jong, John",John de Jong,"de Jong, John",John de Jong,Confession
JEM,862,Je demeure,Je demeure sous l'abri du Très-Haut,,"Andres, Joël",Joël Andres,"Andres, Joël",Joël Andres,Foi et confiance
JEM,863,Je m'incline,A genoux à tes pieds,,"Pitarella, Daniel",Daniel Pitarella,"Pitarella, Daniel",Daniel Pitarella,Adoration
JEM,864,Je te donne tout,"Prends mon âme, prends mon cœur",,"Dumont, Luc",Luc Dumont,"Dumont, Luc",Luc Dumont,Engagement
JEM,865,Je t'aime,Je dépose devant toi,,"Hirschi, Crystel",Crystel Hirschi,"Hirschi, Crystel",Crystel Hirschi,Consécration
JEM,866,Je te louerai,Je t'exalterai,,"Chellembron, Gilbert",Gilbert Chellembron,"Chellembron, Gilbert",Gilbert Chellembron,Louange
JEM,867,"Jésus, tu es digne",Tu as été immolé,,"Andres, Joël",Joël Andres,"Andres, Joël",Joël Andres,Jésus-Christ
JEM,868,"Jésus, tu es là",Quand le peuple de Dieu,,"Decourroux, Philippe",Philippe Decourroux,"Decourroux, Philippe",Philippe Decourroux,Evangélisation
JEM,869,L'Esprit et l'épouse,Il y aura,,"Lafitte, Corinne",Corinne Lafitte,"Lafitte, Corinne",Corinne Lafitte,Exhortation
JEM,870,Le Roi dans sa splendeur,"O Dieu, tu es grand",How Great is our God,"Tomlin, Chris ; Beeves, Jess ; Cash, Ed",Chris Tomlin ; Jess Beeves & Ed Cash,"Tomlin, Chris ; Beeves, Jess ; Cash, Ed",Chris Tomlin ; Jess Beeves & Ed Cash,Adoration
JEM,871,Majesté,Me voici,Majesty,"Garrard, Stuart ; Smith, Martin",Stuart Garrard ; Martin Smith,"Garrard, Stuart ; Smith, Martin",Stuart Garrard ; Martin Smith,Adoration
JEM,872,Merci,J'ai juste quelques mots,,"Reymond, François",François Reymond,"Reymond, François",François Reymond,Reconnaissance
JEM,873,Nous te donnons,O Seigneur enseigne-nous,,"Ternisien, Nicolas",Nicolas Ternisien,"Ternisien, Nicolas",Nicolas Ternisien,Consécration
JEM,874,"Merveilleux, si merveilleux","Dieu merveilleux, je t'aime",Beautifull One,"Hughes, Tim",Tim Hughes,"Hughes, Tim",Tim Hughes,Adoration
JEM,875,Mon plus cher désir,Je te donne mon cœur,This is my desire,"Morgan, Reuben",Reuben Morgan,"Morgan, Reuben",Reuben Morgan,Consécration
JEM,876,Mon rédempteur vit,Je sais qu'il m'a secouru,My Redeemer Lives,"Morgan, Reuben",Reuben Morgan,"Morgan, Reuben",Reuben Morgan,Confession
JEM,877,Mon seul souhait,Tu es mon maître,,"de Katow, Pierre-Nicolas",Pierre-Nicolas de Katow,"de Katow, Pierre-Nicolas",Pierre-Nicolas de Katow,Consécration
JEM,878,Nous nous tournons vers toi,Car tu es le seul digne de recevoir,,"Freymond, Sylvain",Sylvain Freymond,"Freymond, Sylvain",Sylvain Freymond,Adoration
JEM,879,Nous sommes une maison,Tu es l'oasis au milieu du désert,,"Freymond, Sylvain",Sylvain Freymond,"Freymond, Sylvain",Sylvain Freymond,Eglise
JEM,880,Nous voulons voir Jésus,"Nous avons soif, nous avons faim",,"Berning, Pat",Pat Berning,"Berning, Pat",Pat Berning,Evangélisation
JEM,881,Pour toi seul,,,Air argentin,Air argentin,Inconnu,Inconnu,Joie et célébration
JEM,882,"Que jamais, ô mon Seigneur",Donne-moi un cœur qui aime,,"Pialat, Daniel",Daniel Pialat,"Pialat, Daniel",Daniel Pialat,Consécration
JEM,883,Ressuscité,Ils avaient scellé la pierre,,"Picotin, Richard",Richard Picotin,"Picotin, Richard",Richard Picotin,Proclamation
JEM,884,Saint est le Seigneur,"Le salut, la gloire",,"Siounath, Charly & Isabelle",Isabelle & Charly Siounath,"Siounath, Charly & Isabelle",Isabelle & Charly Siounath,Adoration
JEM,885,Seule voie,J'abandonne ma vie à tes pieds,One way,"Douglass, Jonathan ; Houston, Joël",Jonathan Douglass ; Joël Houston,"Douglass, Jonathan ; Houston, Joël",Jonathan Douglass ; Joël Houston,Evangélisation
JEM,886,Si ton ciel,N'oublie jamais,,"Schneider, Rolf",Rolf Schneider,"Schneider, Rolf",Rolf Schneider,Identité
JEM,887,Soleil levant,Tu es le soleil levant,,"Durham, David ; Reymond, François",David Durham ; François Reymond,"Durham, David ; Reymond, François",David Durham ; François Reymond,Adoration
JEM,888,Tu lis dans mon coeur,Et je vis pour ça,,"Ternisien, Nicolas",Nicolas Ternisien,"Ternisien, Nicolas",Nicolas Ternisien,Confession
JEM,889,Tu n'as pas choisi,Nous t'adorons Fils de Dieu,,"Freymond, Sylvain",Sylvain Freymond,"Freymond, Sylvain",Sylvain Freymond,Jésus-Christ
JEM,890,Tu oublies,Car tu maintiens l'univers,,"Hausammann, Pascal",Pascal Hausammann,"Hausammann, Pascal",Pascal Hausammann,Proclamation
JEM,891,Yeshoua,Je fléchis le genou devant le fils de Dieu,,"Fernandez, Rafaël ; Schneider, Rolf",Rafaël Fernandez ; Rolf Schneider,"Fernandez, Rafaël ; Schneider, Rolf",Rafaël Fernandez ; Rolf Schneider,Jésus-Christ
JEM,892,À tes pieds,Je suis à ma place,,"Freymond, Sylvain ; Schneider, Rolf",Sylvain Freymond ; Rolf Schneider,"Freymond, Sylvain ; Schneider, Rolf",Sylvain Freymond ; Rolf Schneider,Intimité
JEM,893,À la croix,"Seigneur, tu me cherches",At the Cross,"Zschech, Darlène  ; Morgan, Reuben",Darlène Zschech ; Reuben Morgan,"Zschech, Darlène  ; Morgan, Reuben",Darlène Zschech ; Reuben Morgan,Jésus-Christ
JEM,894,Accueilli dans les parvis du Roi,Et je tombe face à terre,Welcomed into the courts of the King,"Redman, Matt et Beth",Matt et Beth Redman,"Redman, Matt et Bath",Matt et Bath Redman,Intimité
JEM,895,Comme aux jours du prophète Elie,,These are the days of Elijah,"Mark, Robin",Robin Mark,"Mark, Robin",Robin Mark,Prophétique
JEM,896,Création,Tu as tiré du néant,,"Bourbouze, Elisabeth",Elisabeth Bourbouze,"Bourbouze, Elisabeth",Elisabeth Bourbouze,Dieu
JEM,897,"Dansez, dansez",Ô grâce immense qui est venue,"Dance dance, everybody dance","Newton, John ; Hughes, Tim",John Newton ; Tim Hughes,"Newton, John ; Hughes, Tim",John Newton ; Tim Hughes,Joie et célébration
JEM,898,Debout,Viens par ta lumière,,"Fuchs, Markus",Markus Fuchs,"Fuchs, Markus",Markus Fuchs,Appel
JEM,899,Dieu est grand,La création crie à toi,God is great,"Sampson, Marty",Marty Sampson,"Sampson, Marty",Marty Sampson,Dieu
JEM,900,Dieu incomparable,Du plus haut des sommets,Indescribable,"Story, Laura",Laura Story,"Story, Laura",Laura Story,Dieu
JEM,901,Dieu tu es bon,Et ta grâce envers nous dure à jamais,You are good,"Houghton, Israël",Israël Houghton,"Houghton, Israël",Israël Houghton,Dieu
JEM,902,Digne est l'Agneau sacrifié,"Saint, oui saint, trois fois saint",Revelation Song,"Riddle, Jennie Lee",Jennie Lee Riddle,"Riddle, Jennie Lee",Jennie Lee Riddle,Adoration
JEM,903,"Jésus, espoir des nations",Tu es venu vivre et mourir,Hope of the nations,"Doerksen, Brian",Brian Doerksen,"Doerksen, Brian",Brian Doerksen,Espérance
JEM,904,"Éternel, que ton nom soit élevé",,,"Bussy, Jean-François",Jean-François Bussy,"Bussy, Jean-François",Jean-François Bussy,Dieu
JEM,905,Fort,Dieu est si fort,,"Fuchs, Markus",Markus Fuchs,"Fuchs, Markus",Markus Fuchs,Combat spirituel
JEM,906,Hosanna (Baloche),Un chant s'élève,Hosanna,"Baloche, Paul ; Brown, Brenton",Paul Baloche ; Brenton Brown,"Baloche, Paul ; Brown, Brenton",Paul Baloche ; Brenton Brown,Espérance
JEM,907,Hosanna (Fraser),Je vois le Roi de gloire,Hosanna,"Fraser, Brooke",Brooke Fraser,"Fraser, Brooke",Brooke Fraser,Foi et confiance
JEM,908,J'ai envie de crier,Je ne peux que te dire,,"Marvane, Matthieu",Matthieu Marvane,"Marvane, Matthieu",Matthieu Marvane,Reconnaissance
JEM,909,J'irai,Montre-moi la voie,,"Dumont, Luc et Marie",Luc et Marie Dumont,"Dumont, Luc et Marie",Luc et Marie Dumont,Engagement
JEM,910,Je chanterai gloire,Je viens t'offrir,,"Marvane, Matthieu",Matthieu Marvane,"Marvane, Matthieu",Matthieu Marvane,Louange
JEM,911,Je lève les yeux,Si je suis seul,,"Unger, Stéphane ; Schneider, Rolf",Stéphane Unger ; Rolf Schneider,"Unger, Stéphane ; Schneider, Rolf",Stéphane Unger ; Rolf Schneider,Espérance
JEM,912,Je peux tout,Plus grand est celui,,"Dumont, Luc",Luc Dumont,"Dumont, Luc",Luc Dumont,Foi et confiance
JEM,913,Je t'admire,Rien ne pourrait,,"Unger, Stéphane",Stéphane Unger,"Unger, Stéphane",Stéphane Unger,Jésus-Christ
JEM,914,Je t'adore Seigneur,Par tes blessures je suis guéri,,"Keller, Lilo",Lilo Keller,"Keller, Lilo",Lilo Keller,Adoration
JEM,915,Je te célèbre,"Tu es vie, tu es amour",,"Küffer, Stéphanie",Stéphanie Küffer,"Küffer, Stéphanie",Stéphanie Küffer,Joie et célébration
JEM,916,Je te loue,Comme le soleil,,"Oskera, Caroline",Caroline Oskera,"Oskera, Caroline",Caroline Oskera,Louange
JEM,917,Je viens dans ta maison,Texte supprimé,,"Favreau, André et Lynne-Marie",André et Lynne-Marie Favreau,"Favreau, André et Lynne-Marie",André et Lynne-Marie Favreau,Eglise
JEM,918,"Jesus, le magnifique",Tu as reçu l'onction royale,,"Bourbouze, Elisabeth",Elisabeth Bourbouze,"Bourbouze, Elisabeth",Elisabeth Bourbouze,Jésus-Christ
JEM,919,L'univers chante le nom,"Jésus, tu es tout pour moi",,"Schneider, Rolf",Rolf Schneider,"Schneider, Rolf",Rolf Schneider,Jésus-Christ
JEM,920,La terre entière,Tu dis,All the Earth,"Baloche, Paul",Paul Baloche,"Baloche, Paul",Paul Baloche,Combat spirituel
JEM,921,Le Roi vient,L'humanité t'attend,,"Robertson, Judith Ann",Judith Ann Robertson,"Robertson, Judith Ann",Judith Ann Robertson,Jésus-Christ
JEM,922,Mélodie venue du ciel,"Saint, ô Éternel, Dieu de l'univers",,"Boungou, Marcel",Marcel Boungou,"Boungou, Marcel",Marcel Boungou,Adoration
JEM,923,Mon âme cherche ta présence,Soudain plongé dans ta lumière immense,,"Lafitte, Corinne",Corinne Lafitte,"Lafitte, Corinne",Corinne Lafitte,Intimité
JEM,924,Mon refuge,Tu garderas celui qui t'aime,,"Unger, Stéphane",Stéphane Unger,"Unger, Stéphane",Stéphane Unger,Foi et confiance
JEM,925,Notre Père créateur,"Mon Dieu, mon Seigneur, le Tout-Puissant",,"Schaub, Mario",Mario Schaub,"Schaub, Mario",Mario Schaub,Dieu
JEM,926,Notre force sera renouvelée,Tu es le Dieu d'éternité,Strength will rise,"Brown, Brenton ; Riley, Ken",Brenton Brown ; Ken Riley,"Brown, Brenton ; Riley, Ken",Brenton Brown ; Ken Riley,Foi et confiance
JEM,927,Offrons au Seigneur reconnaissance,,Give Thanks to the Lord,"Tomlin, Chris",Chris Tomlin,"Tomlin, Chris",Chris Tomlin,Proclamation
JEM,928,Oui je t'aime,Quels mots tracerait,,"Freymond, Sylvain",Sylvain Freymond,"Freymond, Sylvain",Sylvain Freymond,Intimité
JEM,929,Pas d'autre Dieu,Vie abondante,,"Fuchs, Markus",Markus Fuchs,"Fuchs, Markus",Markus Fuchs,Dieu
